{
  "description": "OpenAI Responses API returns a JSON-only Unicorn tool call.",
  "provenance": {
    "provider": "openai",
    "capture_kind": "contract_derived",
    "source": "server_app.py OpenAI Responses request builder and output-text parser",
    "sanitized": true,
    "notes": "The shape records the old parser contract; it is not claimed as a live API capture."
  },
  "provider_request": {
    "model": "gpt-4.1",
    "instructions": "Use only advertised Unicorn tools and return one JSON object.",
    "input": [
      {
        "role": "user",
        "content": [
          {
            "type": "input_text",
            "text": "Tell me about taxid 33090."
          }
        ]
      }
    ],
    "text": {
      "format": {
        "type": "json_schema",
        "name": "unicorn_provider_turn_response",
        "strict": true,
        "schema": {
          "type": "object",
          "additionalProperties": false,
          "required": [
            "type",
            "tool_name",
            "args"
          ],
          "properties": {
            "type": {
              "const": "tool_call"
            },
            "tool_name": {
              "type": "string"
            },
            "args": {
              "type": "object"
            }
          }
        }
      }
    }
  },
  "raw_provider_response": {
    "id": "resp_fixture_openai_tool",
    "object": "response",
    "created_at": 0,
    "status": "completed",
    "model": "gpt-4.1",
    "output": [
      {
        "id": "msg_fixture_openai_tool",
        "type": "message",
        "status": "completed",
        "role": "assistant",
        "content": [
          {
            "type": "output_text",
            "annotations": [],
            "text": "{\"type\":\"tool_call\",\"tool_name\":\"get_node_details\",\"args\":{\"taxid\":33090}}"
          }
        ]
      }
    ],
    "usage": {
      "input_tokens": 0,
      "output_tokens": 0,
      "total_tokens": 0
    }
  },
  "expected_extracted_text": "{\"type\":\"tool_call\",\"tool_name\":\"get_node_details\",\"args\":{\"taxid\":33090}}",
  "expected_normalized_response": {
    "schema_version": "unicorn_provider_response_v1",
    "type": "tool_call",
    "tool_id": "node.details",
    "arguments": {
      "taxid": 33090
    }
  },
  "expected_error": null
}
