{
  "description": "OpenAI Responses API returns a JSON-only final answer.",
  "provenance": {
    "provider": "openai",
    "capture_kind": "contract_derived",
    "source": "server_app.py OpenAI Responses request builder and output-text parser",
    "sanitized": true,
    "notes": "No successful OpenAI native response envelope survived in the repository."
  },
  "provider_request": {
    "model": "gpt-4.1",
    "instructions": "Answer only from Unicorn context and return one JSON object.",
    "input": [
      {
        "role": "user",
        "content": [
          {
            "type": "input_text",
            "text": "What min_reads threshold am I using?"
          }
        ]
      }
    ],
    "text": {
      "format": {
        "type": "json_schema",
        "name": "unicorn_provider_turn_response",
        "strict": true,
        "schema": {
          "type": "object",
          "additionalProperties": false,
          "required": [
            "type",
            "content"
          ],
          "properties": {
            "type": {
              "const": "final_answer"
            },
            "content": {
              "type": "string"
            }
          }
        }
      }
    }
  },
  "raw_provider_response": {
    "id": "resp_fixture_openai_final",
    "object": "response",
    "created_at": 0,
    "status": "completed",
    "model": "gpt-4.1",
    "output": [
      {
        "id": "msg_fixture_openai_final",
        "type": "message",
        "status": "completed",
        "role": "assistant",
        "content": [
          {
            "type": "output_text",
            "annotations": [],
            "text": "{\"type\":\"final_answer\",\"content\":\"The current min_reads threshold is 1000.\",\"tool_summary\":[],\"notes\":\"\"}"
          }
        ]
      }
    ],
    "usage": {
      "input_tokens": 0,
      "output_tokens": 0,
      "total_tokens": 0
    }
  },
  "expected_extracted_text": "{\"type\":\"final_answer\",\"content\":\"The current min_reads threshold is 1000.\",\"tool_summary\":[],\"notes\":\"\"}",
  "expected_normalized_response": {
    "schema_version": "unicorn_provider_response_v1",
    "type": "final_answer",
    "content": "The current min_reads threshold is 1000."
  },
  "expected_error": null
}
